<?xml version='1.0' encoding='UTF-8'?>
<!DOCTYPE portfolio SYSTEM "portfolio.dtd">

<portfolio>

<!-- Informations personnelles FOAF -->
<block id="personal_name">
  <content lang="fr">Safa Ferchichi</content>
  <content lang="en">Safa Ferchichi</content>
  <content lang="ar">صفاء فرشيشي</content>
  <content lang="ja">サファ・フェルシシ</content>
</block>

<block id="personal_given_name">
  <content lang="fr">Safa</content>
  <content lang="en">Safa</content>
  <content lang="ar">صفاء</content>
  <content lang="ja">サファ</content>
</block>

<block id="personal_family_name">
  <content lang="fr">Ferchichi</content>
  <content lang="en">Ferchichi</content>
  <content lang="ar">فرشيشي</content>
  <content lang="ja">フェルシシ</content>
</block>

<block id="personal_title">
  <content lang="fr">Étudiante ingénieure en informatique et développeuse web</content>
  <content lang="en">Computer engineering student and web developer</content>
  <content lang="ar">طالبة هندسة معلوماتية ومطورة ويب</content>
  <content lang="ja">情報工学の学生・Web開発者</content>
</block>

<block id="personal_email">
  <content lang="fr">safaferchichi2003@gmail.com</content>
  <content lang="en">safaferchichi2003@gmail.com</content>
  <content lang="ar">safaferchichi2003@gmail.com</content>
  <content lang="ja">safaferchichi2003@gmail.com</content>
</block>

<block id="personal_gender">
  <content lang="fr">female</content>
  <content lang="en">female</content>
  <content lang="ar">female</content>
  <content lang="ja">female</content>
</block>

<block id="personal_location">
  <content lang="fr">Paris, France</content>
  <content lang="en">Paris, France</content>
  <content lang="ar">باريس، فرنسا</content>
  <content lang="ja">パリ、フランス</content>
</block>

<block id="personal_description">
  <content lang="fr">Étudiante en première année de cycle d’ingénieur en informatique à Sup Galilée, passionnée par le développement web, les systèmes d'information et la gestion de projets.</content>
  <content lang="en">First-year computer engineering student at Sup Galilée, passionate about web development, information systems and project management.</content>
  <content lang="ar">طالبة في السنة الأولى هندسة معلوماتية في Sup Galilée، شغوفة بتطوير الويب ونظم المعلومات وإدارة المشاريع.</content>
  <content lang="ja">Sup Galilée の情報工学1年生。Web開発、情報システム、プロジェクト管理に関心があります。</content>
</block>

<!-- Organisations/Entreprises -->
<block id="org_holydis">
  <content lang="fr">SOTEB Modula</content>
  <content lang="en">SOTEB Modula</content>
  <content lang="ar">SOTEB Modula</content>
  <content lang="ja">SOTEB Modula</content>
</block>

<block id="org_sorbonne">
  <content lang="fr">Sup Galilée – Université Sorbonne Paris Nord</content>
  <content lang="en">Sup Galilée – Sorbonne Paris Nord University</content>
  <content lang="ar">Sup Galilée – جامعة سوربون باريس نورد</content>
  <content lang="ja">Sup Galilée – ソルボンヌ・パリ・ノール大学</content>
</block>

<block id="org_upjv">
  <content lang="fr">ISET Radès</content>
  <content lang="en">ISET Radès</content>
  <content lang="ar">المعهد العالي للدراسات التكنولوجية برادس</content>
  <content lang="ja">ISET Radès</content>
</block>

<block id="contact_email_label">
  <content lang="fr">Email :</content>
  <content lang="en">Email:</content>
  <content lang="ar">البريد الإلكتروني:</content>
  <content lang="ja">メール：</content>
</block>

<block id="contact_linkedin_label">
  <content lang="fr">LinkedIn :</content>
  <content lang="en">LinkedIn:</content>
  <content lang="ar">لينكدإن:</content>
  <content lang="ja">リンクトイン：</content>
</block>


<!-- Projets actuels -->
<block id="current_project_ai">
  <content lang="fr">Conception et développement d’applications web</content>
  <content lang="en">Design and development of web applications</content>
  <content lang="ar">تصميم وتطوير تطبيقات الويب</content>
  <content lang="ja">Webアプリケーションの設計・開発</content>
</block>

<block id="current_project_ws">
  <content lang="fr">Portfolio XML, DTD, XSD, XSLT et RDFa</content>
  <content lang="en">XML, DTD, XSD, XSLT and RDFa portfolio</content>
  <content lang="ar">محفظة XML و DTD و XSD و XSLT و RDFa</content>
  <content lang="ja">XML・DTD・XSD・XSLT・RDFa ポートフォリオ</content>
</block>

<!-- Centres d'intérêt/Compétences -->
<block id="interest_ai">
  <content lang="fr">Systèmes d’information</content>
  <content lang="en">Information Systems</content>
  <content lang="ar">نظم المعلومات</content>
  <content lang="ja">情報システム</content>
</block>

<block id="interest_semantic_web">
  <content lang="fr">Web sémantique</content>
  <content lang="en">Semantic Web</content>
  <content lang="ar">الويب الدلالي</content>
  <content lang="ja">セマンティックウェブ</content>
</block>

<block id="interest_fullstack">
  <content lang="fr">Développement web</content>
  <content lang="en">Web Development</content>
  <content lang="ar">تطوير الويب</content>
  <content lang="ja">Web開発</content>
</block>

<block id="page_title">
  <content lang="fr">Safa Ferchichi – Étudiante ingénieure en informatique</content>
  <content lang="en">Safa Ferchichi – Computer Engineering Student</content>
  <content lang="ar">صفاء فرشيشي – طالبة هندسة معلوماتية</content>
  <content lang="ja">サファ・フェルシシ – 情報工学の学生</content>
</block>

<block id="skills_expert_title">
  <content lang="fr">Domaines d’expertise</content>
  <content lang="en">Areas of expertise</content>
  <content lang="ar">مجالات الخبرة</content>
  <content lang="ja">専門分野</content>
</block>


<block id="interest_python">
  <content lang="fr">Python</content>
  <content lang="en">Python</content>
  <content lang="ar">Python</content>
  <content lang="ja">Python</content>
</block>

<block id="interest_csharp">
  <content lang="fr">Laravel</content>
  <content lang="en">Laravel</content>
  <content lang="ar">Laravel</content>
  <content lang="ja">Laravel</content>
</block>

<block id="interest_rdf">
  <content lang="fr">XML / RDFa</content>
  <content lang="en">XML / RDFa</content>
  <content lang="ar">XML / RDFa</content>
  <content lang="ja">XML / RDFa</content>
</block>

<block id="interest_sparql">
  <content lang="fr">SQL / PLSQL</content>
  <content lang="en">SQL / PLSQL</content>
  <content lang="ar">SQL / PLSQL</content>
  <content lang="ja">SQL / PLSQL</content>
</block>

<!-- Comptes en ligne -->
<block id="account_linkedin_name">
  <content lang="fr">safa-ferchichi-06948924b</content>
  <content lang="en">safa-ferchichi-06948924b</content>
  <content lang="ar">safa-ferchichi-06948924b</content>
  <content lang="ja">safa-ferchichi-06948924b</content>
</block>

<block id="account_linkedin_url">
  <content lang="fr">https://www.linkedin.com/in/safa-ferchichi-06948924b/</content>
  <content lang="en">https://www.linkedin.com/in/safa-ferchichi-06948924b/</content>
  <content lang="ar">https://www.linkedin.com/in/safa-ferchichi-06948924b/</content>
  <content lang="ja">https://www.linkedin.com/in/safa-ferchichi-06948924b/</content>
</block>

<!-- Formation -->
<block id="education_title">
  <content lang="fr">Formation</content>
  <content lang="en">Education</content>
  <content lang="ar">التعليم</content>
  <content lang="ja">学歴</content>
</block>

<block id="education_sorbonne">
  <content lang="fr">Diplôme d’ingénieur en informatique – Sup Galilée, Université Sorbonne Paris Nord (2024–aujourd’hui)</content>
  <content lang="en">Computer Engineering Degree – Sup Galilée, Sorbonne Paris Nord University (2024–present)</content>
  <content lang="ar">دبلوم هندسة في الإعلامية – Sup Galilée، جامعة سوربون باريس نورد (2024–الآن)</content>
  <content lang="ja">情報工学エンジニア課程 – Sup Galilée, Sorbonne Paris Nord University（2024年〜現在）</content>
</block>
<block id="period_holydis_ai">
  <content lang="fr">Février 2024 – Mai 2024</content>
  <content lang="en">February 2024 – May 2024</content>
  <content lang="ar">فبراير 2024 – مايو 2024</content>
  <content lang="ja">2024年2月〜2024年5月</content>
</block>

<block id="period_holydis_fs">
  <content lang="fr">Janvier 2023 – Février 2023</content>
  <content lang="en">January 2023 – February 2023</content>
  <content lang="ar">يناير 2023 – فبراير 2023</content>
  <content lang="ja">2023年1月〜2023年2月</content>
</block>

<block id="current_project_fs">
  <content lang="fr">Applications web avec Laravel, Symfony et PHP</content>
  <content lang="en">Web applications with Laravel, Symfony and PHP</content>
  <content lang="ar">تطبيقات ويب باستخدام Laravel و Symfony و PHP</content>
  <content lang="ja">Laravel・Symfony・PHPによるWebアプリケーション</content>
</block>

<block id="education_upjv">
  <content lang="fr">Licence appliquée en Technologies de l’informatique, spécialité Développement des Systèmes d’Information – ISET Radès (2021–2024)</content>
  <content lang="en">Applied Bachelor in Information Technology, Information Systems Development – ISET Radès (2021–2024)</content>
  <content lang="ar">إجازة تطبيقية في تكنولوجيا الإعلامية، اختصاص تطوير نظم المعلومات – ISET Radès (2021–2024)</content>
  <content lang="ja">応用情報技術学士・情報システム開発専攻 – ISET Radès（2021年〜2024年）</content>
</block>

<!-- Compétences -->
<block id="skills_title">
  <content lang="fr">Compétences Techniques</content>
  <content lang="en">Technical Skills</content>
  <content lang="ar">المهارات التقنية</content>
  <content lang="ja">技術スキル</content>
</block>
<block id="education_upjv_title">
  <content lang="fr">Licence appliquée en Technologies de l’informatique</content>
  <content lang="en">Applied Bachelor in Information Technology</content>
  <content lang="ar">إجازة تطبيقية في تكنولوجيا الإعلامية</content>
  <content lang="ja">応用情報技術学士</content>
</block>

<block id="period_upjv">
  <content lang="fr">2021 – 2024</content>
  <content lang="en">2021 – 2024</content>
  <content lang="ar">2021 – 2024</content>
  <content lang="ja">2021年〜2024年</content>
</block>

<block id="skills_list">
  <content lang="fr">Laravel, Symfony, PHP, Java, C, C++, Python, JavaScript, Angular, Android, SQL/PLSQL, MongoDB, Power BI, SSIS, Excel</content>